{"componentChunkName":"component---src-components-posts-js","path":"/blog/how-to-configure-a-4k-screen-in-linux/","result":{"data":{"site":{"siteMetadata":{"repositoryUrl":"https://github.com/dobladov/mdx-blog/edit/master/"}},"mdx":{"body":"function _extends() { _extends = Object.assign || function (target) { for (var i = 1; i < arguments.length; i++) { var source = arguments[i]; for (var key in source) { if (Object.prototype.hasOwnProperty.call(source, key)) { target[key] = source[key]; } } } return target; }; return _extends.apply(this, arguments); }\n\nfunction _objectWithoutProperties(source, excluded) { if (source == null) return {}; var target = _objectWithoutPropertiesLoose(source, excluded); var key, i; if (Object.getOwnPropertySymbols) { var sourceSymbolKeys = Object.getOwnPropertySymbols(source); for (i = 0; i < sourceSymbolKeys.length; i++) { key = sourceSymbolKeys[i]; if (excluded.indexOf(key) >= 0) continue; if (!Object.prototype.propertyIsEnumerable.call(source, key)) continue; target[key] = source[key]; } } return target; }\n\nfunction _objectWithoutPropertiesLoose(source, excluded) { if (source == null) return {}; var target = {}; var sourceKeys = Object.keys(source); var key, i; for (i = 0; i < sourceKeys.length; i++) { key = sourceKeys[i]; if (excluded.indexOf(key) >= 0) continue; target[key] = source[key]; } return target; }\n\n/* @jsxRuntime classic */\n\n/* @jsx mdx */\nvar _frontmatter = {\n  \"title\": \"How to configure a 4k screen in Linux\",\n  \"date\": \"2020-04-18T00:00:00.000Z\",\n  \"tags\": [\"4k\", \"Screen\", \"Xrandr\", \"KDE\"],\n  \"hook\": \"Troubles with your screen?, here is how to fix it.\"\n};\nvar layoutProps = {\n  _frontmatter: _frontmatter\n};\nvar MDXLayout = \"wrapper\";\nreturn function MDXContent(_ref) {\n  var components = _ref.components,\n      props = _objectWithoutProperties(_ref, [\"components\"]);\n\n  return mdx(MDXLayout, _extends({}, layoutProps, props, {\n    components: components,\n    mdxType: \"MDXLayout\"\n  }), mdx(\"p\", null, \"You just got a new cool 4K monitor, you opened it, connected it to your Linux device and the first thing you face is that you can\\u2019t select the maximum resolution for the screen.\"), mdx(\"blockquote\", null, mdx(\"p\", {\n    parentName: \"blockquote\"\n  }, \"My disappointment is immeasurable and my day is ruined. \\u2014Reviewbrah\")), mdx(\"h2\", {\n    \"id\": \"why-is-this-problem-happening\",\n    \"style\": {\n      \"position\": \"relative\"\n    }\n  }, mdx(\"a\", {\n    parentName: \"h2\",\n    \"href\": \"#why-is-this-problem-happening\",\n    \"aria-label\": \"why is this problem happening permalink\",\n    \"className\": \"anchor before\"\n  }, mdx(\"svg\", {\n    parentName: \"a\",\n    \"aria-hidden\": \"true\",\n    \"focusable\": \"false\",\n    \"height\": \"16\",\n    \"version\": \"1.1\",\n    \"viewBox\": \"0 0 16 16\",\n    \"width\": \"16\"\n  }, mdx(\"path\", {\n    parentName: \"svg\",\n    \"fillRule\": \"evenodd\",\n    \"d\": \"M4 9h1v1H4c-1.5 0-3-1.69-3-3.5S2.55 3 4 3h4c1.45 0 3 1.69 3 3.5 0 1.41-.91 2.72-2 3.25V8.59c.58-.45 1-1.27 1-2.09C10 5.22 8.98 4 8 4H4c-.98 0-2 1.22-2 2.5S3 9 4 9zm9-3h-1v1h1c1 0 2 1.22 2 2.5S13.98 12 13 12H9c-.98 0-2-1.22-2-2.5 0-.83.42-1.64 1-2.09V6.25c-1.09.53-2 1.84-2 3.25C6 11.31 7.55 13 9 13h4c1.45 0 3-1.69 3-3.5S14.5 6 13 6z\"\n  }))), \"Why is this problem happening?\"), mdx(\"p\", null, \"Apparently some screens might not give the correct \", mdx(\"a\", {\n    parentName: \"p\",\n    \"href\": \"https://en.wikipedia.org/wiki/Extended_Display_Identification_Data\"\n  }, \"EDID\"), \" information, in my case a \", mdx(\"a\", {\n    parentName: \"p\",\n    \"href\": \"https://www.samsung.com/us/business/support/owners/product/ue850-series-u28e850r/\"\n  }, \"SAMSUNG LU28E85KRS\"), \", this makes impossible to select all supported modes for our screen, showing some default ones, without including resolutions greater than 1920x1080.\"), mdx(\"h2\", {\n    \"id\": \"how-to-get-the-correct-edid-and-set-it-using-xrandr\",\n    \"style\": {\n      \"position\": \"relative\"\n    }\n  }, mdx(\"a\", {\n    parentName: \"h2\",\n    \"href\": \"#how-to-get-the-correct-edid-and-set-it-using-xrandr\",\n    \"aria-label\": \"how to get the correct edid and set it using xrandr permalink\",\n    \"className\": \"anchor before\"\n  }, mdx(\"svg\", {\n    parentName: \"a\",\n    \"aria-hidden\": \"true\",\n    \"focusable\": \"false\",\n    \"height\": \"16\",\n    \"version\": \"1.1\",\n    \"viewBox\": \"0 0 16 16\",\n    \"width\": \"16\"\n  }, mdx(\"path\", {\n    parentName: \"svg\",\n    \"fillRule\": \"evenodd\",\n    \"d\": \"M4 9h1v1H4c-1.5 0-3-1.69-3-3.5S2.55 3 4 3h4c1.45 0 3 1.69 3 3.5 0 1.41-.91 2.72-2 3.25V8.59c.58-.45 1-1.27 1-2.09C10 5.22 8.98 4 8 4H4c-.98 0-2 1.22-2 2.5S3 9 4 9zm9-3h-1v1h1c1 0 2 1.22 2 2.5S13.98 12 13 12H9c-.98 0-2-1.22-2-2.5 0-.83.42-1.64 1-2.09V6.25c-1.09.53-2 1.84-2 3.25C6 11.31 7.55 13 9 13h4c1.45 0 3-1.69 3-3.5S14.5 6 13 6z\"\n  }))), \"How to get the correct EDID and set it using xrandr\"), mdx(\"h3\", {\n    \"id\": \"getting-the-correct-edid\",\n    \"style\": {\n      \"position\": \"relative\"\n    }\n  }, mdx(\"a\", {\n    parentName: \"h3\",\n    \"href\": \"#getting-the-correct-edid\",\n    \"aria-label\": \"getting the correct edid permalink\",\n    \"className\": \"anchor before\"\n  }, mdx(\"svg\", {\n    parentName: \"a\",\n    \"aria-hidden\": \"true\",\n    \"focusable\": \"false\",\n    \"height\": \"16\",\n    \"version\": \"1.1\",\n    \"viewBox\": \"0 0 16 16\",\n    \"width\": \"16\"\n  }, mdx(\"path\", {\n    parentName: \"svg\",\n    \"fillRule\": \"evenodd\",\n    \"d\": \"M4 9h1v1H4c-1.5 0-3-1.69-3-3.5S2.55 3 4 3h4c1.45 0 3 1.69 3 3.5 0 1.41-.91 2.72-2 3.25V8.59c.58-.45 1-1.27 1-2.09C10 5.22 8.98 4 8 4H4c-.98 0-2 1.22-2 2.5S3 9 4 9zm9-3h-1v1h1c1 0 2 1.22 2 2.5S13.98 12 13 12H9c-.98 0-2-1.22-2-2.5 0-.83.42-1.64 1-2.09V6.25c-1.09.53-2 1.84-2 3.25C6 11.31 7.55 13 9 13h4c1.45 0 3-1.69 3-3.5S14.5 6 13 6z\"\n  }))), \"Getting the correct EDID\"), mdx(\"p\", null, \"Thanks to this wonderful answer \", mdx(\"a\", {\n    parentName: \"p\",\n    \"href\": \"https://unix.stackexchange.com/a/323121\"\n  }, \"How to get EDID for a single monitor?\"), \" by \", mdx(\"a\", {\n    parentName: \"p\",\n    \"href\": \"https://unix.stackexchange.com/users/32896/malat\"\n  }, \"Malat\"), \", obtaining the correct information is easy.\"), mdx(\"pre\", null, mdx(\"code\", {\n    parentName: \"pre\",\n    \"className\": \"hljs language-bash\"\n  }, \"sudo apt install read-edid\\nsudo get-edid | parse-edid\")), mdx(\"p\", null, \"Cool, we get all supported modes.\"), mdx(\"pre\", null, mdx(\"code\", {\n    parentName: \"pre\",\n    \"className\": \"hljs language-bash\"\n  }, \"Modeline    \", mdx(\"span\", {\n    parentName: \"code\",\n    \"className\": \"hljs-string\"\n  }, \"\\\"Mode 1\\\"\"), \" 148.500 1920 2008 2052 2200 1080 1084 1089 1125 +hsync +vsync\\nModeline    \", mdx(\"span\", {\n    parentName: \"code\",\n    \"className\": \"hljs-string\"\n  }, \"\\\"Mode 0\\\"\"), \" 297.00 3840 4016 4104 4400 2160 2168 2178 2250 +hsync +vsync \\nModeline    \", mdx(\"span\", {\n    parentName: \"code\",\n    \"className\": \"hljs-string\"\n  }, \"\\\"Mode 2\\\"\"), \" 74.250 1280 1390 1420 1650 720 725 730 750 +hsync +vsync\\nModeline    \", mdx(\"span\", {\n    parentName: \"code\",\n    \"className\": \"hljs-string\"\n  }, \"\\\"Mode 3\\\"\"), \" 148.500 1920 2448 2492 2640 1080 1084 1089 1125 +hsync +vsync\\nModeline    \", mdx(\"span\", {\n    parentName: \"code\",\n    \"className\": \"hljs-string\"\n  }, \"\\\"Mode 4\\\"\"), \" 74.250 1280 1720 1760 1980 720 725 730 750 +hsync +vsync\\nModeline    \", mdx(\"span\", {\n    parentName: \"code\",\n    \"className\": \"hljs-string\"\n  }, \"\\\"Mode 5\\\"\"), \" 27.027 720 736 798 858 480 489 495 525 -hsync -vsync\\nModeline    \", mdx(\"span\", {\n    parentName: \"code\",\n    \"className\": \"hljs-string\"\n  }, \"\\\"Mode 6\\\"\"), \" 27.000 720 732 796 864 576 581 586 625 -hsync -vsync\\nModeline    \", mdx(\"span\", {\n    parentName: \"code\",\n    \"className\": \"hljs-string\"\n  }, \"\\\"Mode 7\\\"\"), \" 74.250 1920 2558 2602 2750 1080 1084 1089 1125 +hsync +vsync\\nModeline    \", mdx(\"span\", {\n    parentName: \"code\",\n    \"className\": \"hljs-string\"\n  }, \"\\\"Mode 8\\\"\"), \" 74.250 1920 2008 2052 2200 1080 1084 1089 1125 +hsync +vsync\\nModeline    \", mdx(\"span\", {\n    parentName: \"code\",\n    \"className\": \"hljs-string\"\n  }, \"\\\"Mode 9\\\"\"), \" 148.50 1920 2008 2052 2200 1080 1084 1089 1125 +hsync +vsync \\nModeline    \", mdx(\"span\", {\n    parentName: \"code\",\n    \"className\": \"hljs-string\"\n  }, \"\\\"Mode 10\\\"\"), \" 148.50 1920 2448 2492 2640 1080 1084 1089 1125 +hsync +vsync \\nModeline    \", mdx(\"span\", {\n    parentName: \"code\",\n    \"className\": \"hljs-string\"\n  }, \"\\\"Mode 11\\\"\"), \" 74.25 1280 1390 1430 1650 720 725 730 750 +hsync +vsync \\nModeline    \", mdx(\"span\", {\n    parentName: \"code\",\n    \"className\": \"hljs-string\"\n  }, \"\\\"Mode 12\\\"\"), \" 241.50 2560 2608 2640 2720 1440 1443 1448 1481 +hsync -vsync \")), mdx(\"h3\", {\n    \"id\": \"adding-the-new-modes-with-xrandr\",\n    \"style\": {\n      \"position\": \"relative\"\n    }\n  }, mdx(\"a\", {\n    parentName: \"h3\",\n    \"href\": \"#adding-the-new-modes-with-xrandr\",\n    \"aria-label\": \"adding the new modes with xrandr permalink\",\n    \"className\": \"anchor before\"\n  }, mdx(\"svg\", {\n    parentName: \"a\",\n    \"aria-hidden\": \"true\",\n    \"focusable\": \"false\",\n    \"height\": \"16\",\n    \"version\": \"1.1\",\n    \"viewBox\": \"0 0 16 16\",\n    \"width\": \"16\"\n  }, mdx(\"path\", {\n    parentName: \"svg\",\n    \"fillRule\": \"evenodd\",\n    \"d\": \"M4 9h1v1H4c-1.5 0-3-1.69-3-3.5S2.55 3 4 3h4c1.45 0 3 1.69 3 3.5 0 1.41-.91 2.72-2 3.25V8.59c.58-.45 1-1.27 1-2.09C10 5.22 8.98 4 8 4H4c-.98 0-2 1.22-2 2.5S3 9 4 9zm9-3h-1v1h1c1 0 2 1.22 2 2.5S13.98 12 13 12H9c-.98 0-2-1.22-2-2.5 0-.83.42-1.64 1-2.09V6.25c-1.09.53-2 1.84-2 3.25C6 11.31 7.55 13 9 13h4c1.45 0 3-1.69 3-3.5S14.5 6 13 6z\"\n  }))), \"Adding the new modes with xrandr\"), mdx(\"p\", null, \"The first value after the mode number tell us the horizontal resolution, in my case I\\u2019m interested in \", mdx(\"inlineCode\", {\n    parentName: \"p\"\n  }, \"Mode 0\"), \".\"), mdx(\"pre\", null, mdx(\"code\", {\n    parentName: \"pre\",\n    \"className\": \"hljs language-bash\"\n  }, \"Modeline    \", mdx(\"span\", {\n    parentName: \"code\",\n    \"className\": \"hljs-string\"\n  }, \"\\\"Mode 0\\\"\"), \" 297.00 3840 4016 4104 4400 2160 2168 2178 2250 +hsync +vsync \")), mdx(\"p\", null, \"Let\\u2019s create a new mode, we can name it anything we want but I prefer to name if after the output resolution.\"), mdx(\"pre\", null, mdx(\"code\", {\n    parentName: \"pre\",\n    \"className\": \"hljs language-bash\"\n  }, \"xrandr --newmode \", mdx(\"span\", {\n    parentName: \"code\",\n    \"className\": \"hljs-string\"\n  }, \"\\\"3840x2160\\\"\"), \" 297.00 3840 4016 4104 4400 2160 2168 2178 2250 +hsync +\")), mdx(\"p\", null, \"Now we add the mode to the outut, if you are not sure which one is the output, run \", mdx(\"inlineCode\", {\n    parentName: \"p\"\n  }, \"xrandr\"), \" and it will show something like \", mdx(\"inlineCode\", {\n    parentName: \"p\"\n  }, \"HDMI-2 connected\"), \".\"), mdx(\"p\", null, \"We use the name of the output.\"), mdx(\"pre\", null, mdx(\"code\", {\n    parentName: \"pre\",\n    \"className\": \"hljs language-bash\"\n  }, \"xrandr --addmode HDMI-2 3840x2160\")), mdx(\"p\", null, \"\\uD83C\\uDF89 Now the new resolution should be available in the Display settings.\"), mdx(\"p\", null, \"Don\\u2019t forget to set font DPI and screen scale to you taste.\"), mdx(\"h2\", {\n    \"id\": \"useful-information\",\n    \"style\": {\n      \"position\": \"relative\"\n    }\n  }, mdx(\"a\", {\n    parentName: \"h2\",\n    \"href\": \"#useful-information\",\n    \"aria-label\": \"useful information permalink\",\n    \"className\": \"anchor before\"\n  }, mdx(\"svg\", {\n    parentName: \"a\",\n    \"aria-hidden\": \"true\",\n    \"focusable\": \"false\",\n    \"height\": \"16\",\n    \"version\": \"1.1\",\n    \"viewBox\": \"0 0 16 16\",\n    \"width\": \"16\"\n  }, mdx(\"path\", {\n    parentName: \"svg\",\n    \"fillRule\": \"evenodd\",\n    \"d\": \"M4 9h1v1H4c-1.5 0-3-1.69-3-3.5S2.55 3 4 3h4c1.45 0 3 1.69 3 3.5 0 1.41-.91 2.72-2 3.25V8.59c.58-.45 1-1.27 1-2.09C10 5.22 8.98 4 8 4H4c-.98 0-2 1.22-2 2.5S3 9 4 9zm9-3h-1v1h1c1 0 2 1.22 2 2.5S13.98 12 13 12H9c-.98 0-2-1.22-2-2.5 0-.83.42-1.64 1-2.09V6.25c-1.09.53-2 1.84-2 3.25C6 11.31 7.55 13 9 13h4c1.45 0 3-1.69 3-3.5S14.5 6 13 6z\"\n  }))), \"Useful information\"), mdx(\"ul\", null, mdx(\"li\", {\n    parentName: \"ul\"\n  }, mdx(\"a\", {\n    parentName: \"li\",\n    \"href\": \"https://wiki.archlinux.org/index.php/Xrandr\"\n  }, \"Arch wiki xrandr\")), mdx(\"li\", {\n    parentName: \"ul\"\n  }, mdx(\"a\", {\n    parentName: \"li\",\n    \"href\": \"https://gist.github.com/datagrok/410d26e24ec51159cdfd2a400b809705\"\n  }, \"Automate setting the screen\"))));\n}\n;\nMDXContent.isMDXComponent = true;","fileAbsolutePath":"/home/runner/work/mdx-blog/mdx-blog/content/blog/how-to-configure-a-4k-screen-in-linux.md","fields":{"slug":"/blog/how-to-configure-a-4k-screen-in-linux/","date":"2020-04-18T00:00:00.000Z"},"frontmatter":{"title":"How to configure a 4k screen in Linux","tags":["4k","Screen","Xrandr","KDE"],"hook":"Troubles with your screen?, here is how to fix it.","featuredImage":null},"excerpt":"You just got a new cool 4K monitor, you opened it, connected it to your Linux device and the first thing you face is that you can't select…","tableOfContents":{"items":[{"url":"#why-is-this-problem-happening","title":"Why is this problem happening?"},{"url":"#how-to-get-the-correct-edid-and-set-it-using-xrandr","title":"How to get the correct EDID and set it using xrandr","items":[{"url":"#getting-the-correct-edid","title":"Getting the correct EDID"},{"url":"#adding-the-new-modes-with-xrandr","title":"Adding the new modes with xrandr"}]},{"url":"#useful-information","title":"Useful information"}]},"timeToRead":1}},"pageContext":{"id":"9815aa03-ec40-546d-a4cf-7ba7bb11e9a7"}},"staticQueryHashes":["3649515864","63159454"]}